unit,level,source_url,tanggal_ambil
"Jangan lupa juga untuk mempertimbangkan anggaran, ulasan pengguna lain, dan kebijakan perusahaan terkait anak-anak.",tak jelas,https://awasi.id/read/2024/09/23/1268/cara-memilih-sewa-bus-yang-ramah-anak-terbaik-di-jogja/,2026-06-20
Koordinator aksi menyampaikan bahwa pihaknya menerima laporan dari masyarakat setempat terkait adanya dugaan praktik pelangsiran BBM subsidi yang kerap terjadi.,tak jelas,https://awasi.id/read/2026/06/12/6059/awasi-jambi-gelar-aksi-di-spbu-simpang-rimbo-desak-sidak-dan-penindakan-dugaan-pelanggaran-bbm-subsidi/,2026-06-20
Imigrasi Kuala Tungkal turut mengajak masyarakat untuk berperan aktif melaporkan dugaan pelanggaran keimigrasian melalui kanal resmi yang tersedia demi mendukung terciptanya tertib administrasi dan keamanan wilayah.,tak jelas,https://awasi.id/read/2026/06/11/6041/imigrasi-kuala-tungkal-serahkan-berkas-warga-wna-yang-mengajukan-paspor-ri-dengan-data-tidak-sah-ke-kejaksaan/,2026-06-20
Forum yang bertujuan mencari solusi atas berbagai persoalan yang dikeluhkan masyarakat itu diwarnai kekecewaan akibat minimnya kehadiran perusahaan yang diundang.,tak jelas,https://awasi.id/read/2026/04/24/5949/dprd-muaro-jambi-soroti-ketidakhadiran-perusahaan-dalam-rdp-aidi-hatta-kami-akan-panggil-kembali/,2026-06-20
RDP tersebut merupakan tindak lanjut dari pertemuan sebelumnya pada 21 April 2026 sekaligus merespons aspirasi masyarakat yang disampaikan melalui surat Aliansi Rakyat Parit Menggugat Nomor 06/ARPM/IV/2026 tentang penyampaian pendapat di muka umum.,tak jelas,https://awasi.id/read/2026/04/24/5949/dprd-muaro-jambi-soroti-ketidakhadiran-perusahaan-dalam-rdp-aidi-hatta-kami-akan-panggil-kembali/,2026-06-20
"RDP turut dihadiri kepala desa se-Kecamatan Sungai Gelam, unsur pemerintah daerah, tokoh masyarakat, serta sejumlah pelaku usaha yang beroperasi di kawasan tersebut.",tak jelas,https://awasi.id/read/2026/04/24/5949/dprd-muaro-jambi-soroti-ketidakhadiran-perusahaan-dalam-rdp-aidi-hatta-kami-akan-panggil-kembali/,2026-06-20
"Menurut Aidi Hatta, masyarakat mengeluhkan kerusakan jalan yang diduga dipicu oleh aktivitas kendaraan operasional perusahaan dengan muatan yang melebihi kapasitas tonase jalan kabupaten.",tak jelas,https://awasi.id/read/2026/04/24/5949/dprd-muaro-jambi-soroti-ketidakhadiran-perusahaan-dalam-rdp-aidi-hatta-kami-akan-panggil-kembali/,2026-06-20
“Jalan ini dibangun menggunakan anggaran pemerintah untuk kepentingan masyarakat.,tak jelas,https://awasi.id/read/2026/04/24/5949/dprd-muaro-jambi-soroti-ketidakhadiran-perusahaan-dalam-rdp-aidi-hatta-kami-akan-panggil-kembali/,2026-06-20
“Kesehatan adalah hak mendasar yang wajib kami penuhi bagi setiap warga binaan.,tak jelas,https://awasi.id/read/2026/06/09/6038/layanan-kesehatan-gratis-rutan-batam-gelar-edukasi-dan-pemeriksaan-vct-mobile-untuk-warga-binaan/,2026-06-20
"Dengan kegiatan seperti ini, Rutan Batam terus berupaya menghadirkan pelayanan yang layak sebagai bagian dari sistem pembinaan yang manusiawi, profesional, dan selalu mengutamakan pemenuhan hak setiap warga binaan.",tak jelas,https://awasi.id/read/2026/06/09/6038/layanan-kesehatan-gratis-rutan-batam-gelar-edukasi-dan-pemeriksaan-vct-mobile-untuk-warga-binaan/,2026-06-20
"Selain itu, penghargaan tersebut juga menjadi pengakuan atas keberhasilan satuan dalam membangun komunikasi publik yang positif, transparan, dan edukatif kepada masyarakat, sekaligus mendukung program-program prioritas pemerintah, termasuk Program Asta Cita Presiden Republik Indonesia.",tak jelas,https://awasi.id/read/2026/06/08/6022/polres-tanjab-barat-borong-tiga-penghargaan-sekaligus-pada-rakernis-humas-polda-jambi-2026/,2026-06-20
"Kabid Humas Polda Jambi, Kombes Pol Erlan Munaji, S.I.K., M.Si., menyampaikan bahwa penghargaan ini diharapkan dapat menjadi motivasi bagi seluruh jajaran Humas Polri di wilayah Jambi untuk terus meningkatkan kualitas publikasi dan pelayanan informasi kepada masyarakat.",tak jelas,https://awasi.id/read/2026/06/08/6022/polres-tanjab-barat-borong-tiga-penghargaan-sekaligus-pada-rakernis-humas-polda-jambi-2026/,2026-06-20
"Ke depan, penghargaan ini diharapkan mampu memacu peningkatan kompetensi digital, kreativitas, serta profesionalisme personel Humas Polri dalam menghadapi tantangan komunikasi publik di era digital yang terus berkembang, sehingga kehadiran Polri di ruang publik dan media sosial semakin dirasakan manfaatnya oleh masyarakat.(Humas Polres)",tak jelas,https://awasi.id/read/2026/06/08/6022/polres-tanjab-barat-borong-tiga-penghargaan-sekaligus-pada-rakernis-humas-polda-jambi-2026/,2026-06-20
